{"schema":1,"name":"saxpy_fp32","kernel":"saxpy","source":{"origin":"file","path":"examples/saxpy_fp32.ph","text":"@autotune(BLOCK in [16, 8192])\nkernel saxpy(x: tensor<f32>[N], y: tensor<f32>[N], out: tensor<f32>[N], alpha: f32) {\n  let base = ctx.block.x * BLOCK\n  out[base :+ BLOCK] = alpha * x[base :+ BLOCK] + y[base :+ BLOCK]\n}\n","sha256":"1a4f3c6e8ad427f35ca99876cb173b06ab151c24d06234b83753962df66f031c"},"compiler":{"commit":"7676245","chip":"sm_75","indexBits":32},"params":{"BLOCK":16},"dims":{"N":60},"launch":{"grid":[4,1,1],"threads":256,"lanes":32,"warps":8},"tensors":[{"name":"x","elem":"f32","elemBytes":4,"shape":[60],"role":"in"},{"name":"y","elem":"f32","elemBytes":4,"shape":[60],"role":"in"},{"name":"out","elem":"f32","elemBytes":4,"shape":[60],"role":"out"}],"ops":[{"id":0,"kind":"assume_align","ir":"%x.4: tensor<f32>[?] = assume_align %x.0","uniformity":"uniform"},{"id":1,"kind":"dim","ir":"%N.5: index = dim 0 %x.0","uniformity":"uniform"},{"id":2,"kind":"assume_align","ir":"%y.6: tensor<f32>[?] = assume_align %y.1","uniformity":"uniform"},{"id":3,"kind":"assume_align","ir":"%out.7: tensor<f32>[?] = assume_align %out.2","uniformity":"uniform"},{"id":4,"kind":"program_id","span":{"line":3,"col":3,"endLine":3,"endCol":33},"ir":"%8: index = program_id 0","uniformity":"uniform"},{"id":5,"kind":"const","span":{"line":3,"col":3,"endLine":3,"endCol":33},"ir":"%9: index = const 16","uniformity":"uniform"},{"id":6,"kind":"binary","span":{"line":3,"col":3,"endLine":3,"endCol":33},"ir":"%base.10: index = mul %8, %9","uniformity":"uniform"},{"id":7,"kind":"dim","span":{"line":4,"col":3,"endLine":4,"endCol":67},"ir":"%11: index = dim 0 %out.7","uniformity":"uniform"},{"id":8,"kind":"slice","span":{"line":4,"col":3,"endLine":4,"endCol":67},"ir":"%12: tile<f32>[16]@global{align 16} = slice [16] mask [m] %out.7, %base.10, %11","uniformity":"uniform"},{"id":9,"kind":"dim","span":{"line":4,"col":3,"endLine":4,"endCol":67},"ir":"%13: index = dim 0 %x.4","uniformity":"uniform"},{"id":10,"kind":"slice","span":{"line":4,"col":3,"endLine":4,"endCol":67},"ir":"%14: tile<f32>[16]@global{align 16} = slice [16] mask [m] %x.4, %base.10, %13","uniformity":"uniform"},{"id":11,"kind":"materialize","span":{"line":4,"col":3,"endLine":4,"endCol":67},"ir":"%15: tile<f32>[16]@shared = materialize %14","uniformity":"uniform"},{"id":12,"kind":"dim","span":{"line":4,"col":3,"endLine":4,"endCol":67},"ir":"%16: index = dim 0 %y.6","uniformity":"uniform"},{"id":13,"kind":"slice","span":{"line":4,"col":3,"endLine":4,"endCol":67},"ir":"%17: tile<f32>[16]@global{align 16} = slice [16] mask [m] %y.6, %base.10, %16","uniformity":"uniform"},{"id":14,"kind":"materialize","span":{"line":4,"col":3,"endLine":4,"endCol":67},"ir":"%18: tile<f32>[16]@shared = materialize %17","uniformity":"uniform"},{"id":15,"kind":"fused","span":{"line":4,"col":3,"endLine":4,"endCol":67},"ir":"fused (add (mul s#0 #1) #2) %alpha.3, %15, %18, %12","uniformity":"uniform"}],"buffers":[{"id":0,"name":"tile0","bytes":64,"offsetBytes":0,"firstOp":11,"lastOp":15,"scratch":false,"elem":"f32","shape":[16]},{"id":1,"name":"tile1","bytes":64,"offsetBytes":64,"firstOp":14,"lastOp":15,"scratch":false,"elem":"f32","shape":[16]}],"barriers":[{"afterOp":11,"kept":false},{"afterOp":14,"kept":false},{"afterOp":15,"kept":true}],"sharedPeakBytes":128,"ctas":[[0,0,0],[1,0,0],[2,0,0],[3,0,0]],"steps":[{"op":11,"cta":[0,0,0],"iter":{},"reads":[{"tensor":"x","box":[[0,16]]}],"writes":[{"buffer":0,"box":[[0,16]],"bytes":[0,64]}],"map":{"shape":[16],"width":1,"threads":256,"vectorBytes":4},"barrier":{"kept":false}},{"op":14,"cta":[0,0,0],"iter":{},"reads":[{"tensor":"y","box":[[0,16]]}],"writes":[{"buffer":1,"box":[[0,16]],"bytes":[64,128]}],"map":{"shape":[16],"width":1,"threads":256,"vectorBytes":4},"barrier":{"kept":false}},{"op":15,"cta":[0,0,0],"iter":{},"reads":[{"buffer":0,"box":[[0,16]],"bytes":[0,64]},{"buffer":1,"box":[[0,16]],"bytes":[64,128]}],"writes":[{"tensor":"out","box":[[0,16]]}],"map":{"shape":[16],"width":1,"threads":256,"vectorBytes":4}},{"op":11,"cta":[1,0,0],"iter":{},"reads":[{"tensor":"x","box":[[16,32]]}],"writes":[{"buffer":0,"box":[[0,16]],"bytes":[0,64]}],"map":{"shape":[16],"width":1,"threads":256,"vectorBytes":4},"barrier":{"kept":false}},{"op":14,"cta":[1,0,0],"iter":{},"reads":[{"tensor":"y","box":[[16,32]]}],"writes":[{"buffer":1,"box":[[0,16]],"bytes":[64,128]}],"map":{"shape":[16],"width":1,"threads":256,"vectorBytes":4},"barrier":{"kept":false}},{"op":15,"cta":[1,0,0],"iter":{},"reads":[{"buffer":0,"box":[[0,16]],"bytes":[0,64]},{"buffer":1,"box":[[0,16]],"bytes":[64,128]}],"writes":[{"tensor":"out","box":[[16,32]]}],"map":{"shape":[16],"width":1,"threads":256,"vectorBytes":4}},{"op":11,"cta":[2,0,0],"iter":{},"reads":[{"tensor":"x","box":[[32,48]]}],"writes":[{"buffer":0,"box":[[0,16]],"bytes":[0,64]}],"map":{"shape":[16],"width":1,"threads":256,"vectorBytes":4},"barrier":{"kept":false}},{"op":14,"cta":[2,0,0],"iter":{},"reads":[{"tensor":"y","box":[[32,48]]}],"writes":[{"buffer":1,"box":[[0,16]],"bytes":[64,128]}],"map":{"shape":[16],"width":1,"threads":256,"vectorBytes":4},"barrier":{"kept":false}},{"op":15,"cta":[2,0,0],"iter":{},"reads":[{"buffer":0,"box":[[0,16]],"bytes":[0,64]},{"buffer":1,"box":[[0,16]],"bytes":[64,128]}],"writes":[{"tensor":"out","box":[[32,48]]}],"map":{"shape":[16],"width":1,"threads":256,"vectorBytes":4}},{"op":11,"cta":[3,0,0],"iter":{},"reads":[{"tensor":"x","box":[[48,60]],"maskedElems":4}],"writes":[{"buffer":0,"box":[[0,16]],"bytes":[0,64]}],"map":{"shape":[16],"width":1,"threads":256,"vectorBytes":4},"barrier":{"kept":false}},{"op":14,"cta":[3,0,0],"iter":{},"reads":[{"tensor":"y","box":[[48,60]],"maskedElems":4}],"writes":[{"buffer":1,"box":[[0,16]],"bytes":[64,128]}],"map":{"shape":[16],"width":1,"threads":256,"vectorBytes":4},"barrier":{"kept":false}},{"op":15,"cta":[3,0,0],"iter":{},"reads":[{"buffer":0,"box":[[0,16]],"bytes":[0,64]},{"buffer":1,"box":[[0,16]],"bytes":[64,128]}],"writes":[{"tensor":"out","box":[[48,60]],"maskedElems":4}],"map":{"shape":[16],"width":1,"threads":256,"vectorBytes":4}}]}